{
  "schemaVersion": 1,
  "client": {
    "app": "tokenwatch-macos",
    "version": "1.9.0"
  },
  "deviceId": "5d0c6f1e-8a4b-4c2d-9e3f-7a1b2c3d4e5f",
  "timeZone": "Asia/Kolkata",
  "mode": "incremental",
  "rows": [
    {
      "date": "2026-09-23",
      "source": "claude",
      "model": "claude-opus-4-5-20251101",
      "input": 1200,
      "cacheRead": 850000,
      "cacheWrite": 42000,
      "output": 18000,
      "costUSD": 3.21,
      "approximate": false
    },
    {
      "date": "2026-09-24",
      "source": "codex",
      "model": "gpt-5.5",
      "input": 40210,
      "cacheRead": 1290000,
      "cacheWrite": 0,
      "output": 9100,
      "costUSD": 1.07,
      "approximate": false
    },
    {
      "date": "2026-09-24",
      "source": "service.devin",
      "model": "devin",
      "input": 0,
      "cacheRead": 0,
      "cacheWrite": 0,
      "output": 0,
      "costUSD": 4.5,
      "approximate": false
    },
    {
      "date": "2026-09-24",
      "source": "other",
      "model": "deepseek/deepseek-v4",
      "input": 5000,
      "cacheRead": 0,
      "cacheWrite": 0,
      "output": 800,
      "costUSD": 0.004,
      "approximate": true
    }
  ]
}
